id,en,ru,description_formatted_en,description_formatted_ru,is_multiselect,not_applicable_if,schema_sections
L-2,Derivation affixes,"Аффиксы, участвующие в словообразовании",,,,,
L-3,Stems relations in stem compounding,Отношения между соединяемыми основами при сложении основ,,,,,
M-1,Morphosyntactic alignment,Стратегия кодирования глагольных актантов,,,,,
M-2,Word order fixedness,Фиксированность порядка слов,,,,,
M-3,Dominant word order,Основной порядок слов в предложении,,,,,
M-4,Order of nouns and its modifier,Порядок определения и определяемого,,,,,
M-5,Pro-drop,Опущение местоименного подлежащего в неэллиптических предложениях,,,,,
N-1,Clauses order in compound sentence,Линейный порядок компонентов в сложном предложении,,,,,
N-2,Dependent clause distinctions in complex sentences,Особенности подчиненного компонента в сложном предложении,,,,,
N-3,Dependent clause predicate,Оформление сказуемого в придаточном предложении,,,,,
N-4,Compound sentence types,Тип построения сложного предложения,,,,,
N-5,Compound sentence syndesis and asyndeton,Тип связи между элементами сложного предложения,,,,,
