id,en,ru,description_formatted_en,description_formatted_ru,is_multiselect,not_applicable_if,schema_sections
A-1,Number of degrees of vowel height,Количество подъемов гласных,,"<p><b>Степень подъема</b> гласного (сокр. <b>подъем</b>) — степень вертикального расположения языка при произнесении гласного. Акустически подъем определяется по частоте первой форманты (F1) на спектральном срезе речевого сигнала.</p><p>Фонологически различают верхний, средний (один или несколько) и нижний подъемы; гласные более верхнего подъема также называют закрытыми, более нижнего подъема — открытыми. Подъем также называют раствором: чаще всего у гласных различают широкий (=нижний подъём) и узкий (=верхний подъём) растворы.</p><p>Степеней подъема в языках может быть от двух до пяти. Четыре или пять подъемов присутствуют тогда, когда внутри среднего подъема различаются более открытые и более закрытые гласные. Пример: во французском языке четыре подъема, так как различаются средние закрытые и средние открытые гласные: /e/ и /ɛ/, /ø/ и /œ/, /o/ и /ɔ/.</p><p>Во многих языках противопоставление гласных по степени подъема может сопровождать другие признаки, такие как долгота, напряженность и характеристика «продвижение или положение корня языка» (ATR). В таких случаях обычно считается, что основным признаком является не степень подъёма. Например, в диалекте фанти языка акан 5 гласных c  +ATR (/i̘/, /e̘/, /a̘/, /o̘/, /u̘/ и 5 c  -ATR (/i/, /e/, /a/, /o/, /u/). Акустически это может быть похоже на противопоставление по подъёму, но артикуляторно в данном случае задействован другой механизм — продвижение или положение корня языка (ATR).</p>",,,2.1.1
A-2,Vowel height degrees,Подъемы гласных,,,,,2.1.1
A-3,Opposition in openness/closedness for vowel height degrees,Противопоставление по открытости/закрытости в подъемах гласных,,,,,2.1.1
A-4,Degrees of vowel backness,Ряды гласных,,"<p><b>Ряд</b> гласного — это горизонтальное расположение языка при произнесении гласного. Акустически ряд определяется с помощью частоты второй форманты (F2) на спектральном срезе речевого сигнала.</p><p>Фонологически различают передний, средний и задний ряд; средний ряд также называют смешанным.</p><p>Рядов гласных в разных языках наблюдается от одного до трех. Более трех рядов (без дополнительных признаков) ни в одном языке не различается.</p><p>Системы с <b>одним</b> рядом, или <b>линейные</b> системы, состоят из 2-3 гласных. Пример: в абхазском и абазинском языках вокализм представлен 2 гласными одного ряда /а/ и /ы/.</p><p>Если в языке отмечается <b>два</b> ряда, это означает одну из двух ситуаций:</p><ol><li>В языке действительно есть только два ряда (нет среднего ряда).</li><li>В языке три ряда, но в целях упрощения описания два ряда представлены как один. Пример: украинский язык описан с передним и непередним рядами, в непереднем объединены гласный среднего ряда /а/ и гласные заднего ряда /у/ и /о/.</li></ol><p>Наиболее типичны языки с <b>тремя</b> рядами: передним, средним и задним.</p><p>Признак ряда не следует путать с характеристикой «продвижение или положение корня языка» (ATR).</p>",,,2.1.1
A-5,Presence of length degrees,Наличие фонологических ступеней долготы,,"<p><b>Фонологическая ступень долготы</b> у гласных (сокр. <b>долгота</b>) — определенная длительность произнесения, которая позволяет различать несколько гласных фонем одного и того же качества. Долгие гласные обычно записываются с помощью знака ◌ː /aː/, макрона /ā/ или удвоения гласной /aa/.</p><p>Пример фонологической долготы: в финском языке гласные образуют пары по долготе — /a/ и /aː/, /u/ и /uː/ и т.д.</p><p>Долгота может сопровождать другие признаки, такие как ряд, степень подъёма или напряжённость. Пример: английский, где долгота гласных (напр. /ɪ/ и /iː/, /ɔː/ и /ɒ/) является лишь одним из дополнительных признаков, и фонологических ступеней долготы в нем нет.</p><p>Также не следует путать фонологическую долготу с фонетической. Пример: в английском гласные произносятся короче перед глухими согласными, чем перед звонкими (напр. <i>bat</i> [bæ̆t] и <i>bad</i> [bæˑd]), но такая долгота является фонетической, так как она не противопоставляет разные фонемы.</p><p>О числе ступеней долготы в языках мира см. признак A-6.</p><p>О признаках качества гласного см. признаки A-1 (число степеней подъема), A-4 (ряды), A-7 и A-8 (лабиализация), A-9 и A-10 (назализация).</p>",,,2.1.1
A-6,Number of length degrees,Фонологические ступени долготы,,"<p><b>Фонологическая ступень долготы</b> у гласных (сокр. <b>долгота</b>) — определенная длительность произнесения, которая позволяет различать несколько гласных фонем одного и того же качества. Долгие гласные обычно записываются с помощью знака ◌ː /aː/, макрона /ā/ или удвоения гласной /aa/.</p><p>В большинстве языков, где гласные различаются по долготе, противопоставляются две ступени долготы. Пример: в финском языке гласные образуют пары по долготе — /a/ и /aː/, /u/ и /uː/ и т.д. Лишь в небольшом числе языков в чистом виде выступают три ступени долготы. Пример: в некоторых описаниях эстонского выделяются краткие, полудолгие и долгие гласные.</p><p>Не следует путать фонологическую долготу с фонетической. Пример: в английском языке гласные помимо долготы также различаются по ряду и степени подъема, напр. /ɪ/ и /iː/, значит фонологических ступеней долготы в нем нет.</p><p>В некоторых описаниях в качестве долготы описываются другие явления: сочетание гласный + гортанная смычка (например, в тундровом ненецком), «сверхкраткий» шва-образный гласный как третья ступень долготы, историческое различие по долготе/краткости и др.</p><p>Часто долгота связана с другими признаками гласных — подъёмом, напряжённостью и др. Также длительное произнесение является распространенным признаком ударного гласного, см. признак B-4.</p><p>О наличии ступеней долготы в языках мира см. признак A-5.</p><p>О признаках качества гласного см. признаки A-1 (число степеней подъема), A-4 (ряды), A-7 и A-8 (лабиализация), A-9 и A-10 (назализация).</p>",,A-5-2,"2.1.1, 2.1.4"
A-7,Presence of vowel opposition in labialization,Наличие противопоставления гласных по лабиализации,,"<p><b>Лабиализация</b> (тж. <b>огу́бленность</b>) у гласных — дополнительный признак, определяемый работой губ; лабиализованные гласные также называют огу́бленными.</p><p>В ряде языков лабиализация гласных присутствует не как фонологический различительный признак, а как фонетическое свойство конкретных гласных. Пример: русский язык, где есть нелабиализованные гласные /и/, /э/, /а/ и лабиализованные /о/ и /у/.</p><p>О распределении лабиализации по рядам гласных в языках мира см. признак A-8.</p><p>Работа губ в качестве дополнительной артикуляции согласных также называется лабиализацией. О ней подробнее см. признак A-22.</p><p>О губных согласных в языках мира см. признак A-18.</p>",,,2.1.1
A-8,Vowel opposition in labialization,Противопоставление гласных по лабиализации,,"<p><b>Лабиализация</b> (тж. <b>огу́бленность</b>) у гласных — дополнительный признак, определяемый работой губ; лабиализованные гласные также называют огу́бленными.</p><p>Пример фонологической лабиализации — турецкий вокализм: /i/ и /y/, /e/ и /o/ и т. д.</p><p>В ряде языков лабиализация гласных присутствует не как фонологический различительный признак, а как фонетическое свойство конкретных гласных. Пример: русский язык, где есть нелабиализованные гласные /и/, /э/, /а/ и лабиализованные /о/ и /у/.</p><p>Лабиализованными могут быть практически все гласные, но чаще лабиализация встречается в верхнем и среднем подъёме. Лабиализованными гласными обычно являются гласные заднего ряда, однако противопоставление по лабиализации чаще встречается в переднем ряду.</p><p>О наличии лабиализации гласных в языках мира см. признак A-7.</p><p>Работа губ в качестве дополнительной артикуляции согласных также называется лабиализацией. О ней подробнее см. признак A-22.</p><p>О губных согласных в языках мира см. признак A-18.</p>",,A-7-2,2.1.1
A-9,Presence of vowel opposition in nasalization,Наличие противопоставления гласных по назализации,,"<p><b>Назализация</b> у гласных — явление, когда во время произнесения гласных воздух идёт не только через ротовую полость, но и через носовую; назализованные гласные также называют носовыми, неназализованные — ротовыми. Назализованные гласные обычно обозначаются тильдой над гласной /ɑ̃/ или надстрочной n после гласного /aⁿ/.</p><p>О свойствах назализации гласных в языках мира см. признак A-10.</p><p>Разделение потока воздуха между ротовой и носовой полостью в качестве дополнительной артикуляции согласных также называется назализацией. О ней подробнее см. признак A-22.</p>",,,2.1.1
A-10,Vowel opposition in nasalization,Противопоставление гласных по назализации,,"<p><b>Назализация</b> у гласных — явление, когда во время произнесения гласных воздух идёт не только через ротовую полость, но и через носовую; назализованные гласные также называют носовыми, неназализованные — ротовыми. Назализованные гласные обычно обозначаются тильдой над гласной /ã/ или надстрочной n после гласной /aⁿ/.</p><p>О наличии назализации гласных в языках мира см. признак A-9.</p><p>Разделение потока воздуха между ротовой и носовой полостью в качестве дополнительной артикуляции согласных также называется назализацией. О ней подробнее см. признак A-22.</p>",,A-9-2,2.1.1
A-11,Vowel opposition in pharyngealization,Противопоставление гласных по фарингализации,,,,,2.1.1
A-12,Vowel opposition in ATR,Противопоставление гласных по продвинутости корня языка,,,,,2.1.1
A-13,Diphthongs and triphthongs,Наличие дифтонгов и трифтонгов,,"<p><b>Фонологический дифтонг</b> (сокр. <b>дифтонг</b>) — сочетание двух гласных, являющееся одной фонемой; аналогично фонема из трёх гласных называется <b>фонологическим трифтонгом</b> (сокр. <b>трифтонг</b>). Гласный в составе дифтонга или трифтонга называется его компонентом. В дифтонге или трифтонге всегда есть хотя бы один слоговой компонент; неслоговые компоненты часто записываются с дужкой снизу: /aʊ̯/.</p><p>Фонологически дифтонги и трифонги отличаются от артикуляторно близких последовательностей отдельных гласных или сочетаний гласных и полугласных (=фонетических дифтонгов/трифтонгов). Пример фонетического дифтонга: сочетания с /й/ в русском языке, ср. большой [bɐlʲˈʂoɪ̯], где отрезок [oɪ̯] представляет последовательность двух фонем в отличие от англ. boy [bɔɪ] с дифтонгом. Пример фонетического трифтонга: англ. <i>flower</i> [flaʊ̯.ə] с двумя слогами, противопоставленное <i>flour</i> [fl<b>aʊ̯ə̯</b>] с трифтонгом (один слог).</p><p>О разновидностях дифтонгов см. признак A-14.</p>",,,2.1.1
A-14,Types of diphthongs,Типы дифтонгов,,"<p><b>Фонологический дифтонг</b> (сокр. <b>дифтонг</b>) — сочетание двух гласных, являющееся одной фонемой; гласные в составе дифтонга называются его компонентами. Обычно один компонент в дифтонге слоговой, а другой неслоговой. Часто если в дифтонге есть компонент /i/ или /u/, то именно он является неслоговым. Неслоговой компонент может обозначаться дужкой под гласной (◌̯), надстрочным знаком (ᶦ ᶷ), знаком для соответствующего сонанта (j w). Также слитное произношение гласных в дифтонге может обозначаться общей дужкой сверху или снизу (a͡ɪ a͜ɪ).</p><p>Если в дифтонге слоговым является первый компонент, то такой дифтонг называется <b>нисходящим</b> (примеры: /ai̯/, /æɑ̯/), если второй — <b>восходящим</b> (примеры: /ɪ̯a/, /ʉ̯ɔ/).</p><p>Очень редко встречаются <b>равновесные</b> дифтонги, в которых оба компонента имеют равный вес и являются слоговыми. Пример: латышские дифтонги /iɛ/ и /uɔ/.</p><p>Фонологически дифтонги отличаются от артикуляторно близких последовательностей отдельных гласных или сочетаний гласных и полугласных (=фонетических дифтонгов). Пример фонетического дифтонга: сочетания с /й/ в русском языке, ср. большой [bɐlʲˈʂoɪ̯], где отрезок [oɪ̯] представляет последовательность двух фонем в отличие от англ. boy [bɔɪ] с дифтонгом.</p><p>О наличии дифтонгов и трифтонгов в языках мира см. признак A-13.</p>",,A-13-1,2.1.1
A-15,Inventory of obstruents by laryngeal features,Инвентарь шумных согласных по ларингальным признакам,,,,,2.1.1
A-16,Inventory of obstruents by manner of articulation,Типы шумных согласных по способу артикуляции,,"<p>Согласные делятся на <b>шумные</b> и сонорные. <b>Способ образования</b> является одной из основных характеристик согласных, наряду с местом образования. У шумных согласных выделяются три <b>способа образования</b> — взрывные, фрикативные и аффрикаты:</p><ol><li><b>Взрывные</b> начинаются со смычки, а завершаются резким размыканием смычки, напоминающим взрыв. Примеры: p, b, t, d, c, ɟ, k, g, q, ɢ (т, б, к).</li><li><b>Фрикативные</b> образуются при неполном смыкании артикуляторов (например, языка и нёба или губ и зубов) с образованием щели. Примеры: ф, х, с.</li><li><b>Аффрикаты</b> начинаются со смычки, а завершаются плавным размыканием смычки с образованием щели, как при образовании фрикативных. Примеры: ts (c), dz (ʒ), tʃ (č), dʒ (ǯ), pf, kx, ɡɣ, qχ, ɢʁ, tɬ (ƛ, Ł) (ч, ц).</li></ol><p>Термин «смычные согласные» используется для совместного обозначения взрывных и аффрикат, поскольку смычка присутствует в артикуляции согласных обоих типов.</p><p>О разновидностях согласных по месту образования см. признак A-17.</p><p>Помимо основных характеристик у согласных возможны дополнительные характеристики, подробнее см. признак A-22.</p>",,,2.1.1
A-17,Inventory of obstruents by place of articulation,Типы шумных согласных по месту образования,,"<p>Согласные делятся на <b>шумные</b> и сонорные. <b>Место образования</b> является одной из основных характеристик согласных, наряду со способом образования. С точки зрения места образования среди шумных согласных можно выделить пять основных групп:</p><ol><li><b>Губные</b> (тж. <b>лабиальные</b>) — согласные, образуемые с помощью губ. Подробнее см. признак A-18.</li><li><b>Переднеязычные</b> — согласные, образуемые с помощью передней части языка; в зависимости от пассивного органа (места касания) и формы активного органа (пример: русская фонема /д/ и английская /d/) различают множество типов переднеязычных согласных.</li><li><b>Палатальные</b> (от лат. <i>palatum</i> «твердое нёбо»; тж. <b>среднеязычные</b>) — согласные, образуемые с помощью твёрдого нёба и обычно средней части языка. Примеры: c, ɟ, c͡ç, ɟ͡ʝ, ç, ʝ.</li><li><b>Велярные</b> и <b>увулярные</b> — согласные, образуемые с помощью задней части языка и либо заднего (мягкого) нёба (велярные), либо увулы (язычка, увулярные). Подробнее см. признак A-20.</li><li><b>Ларингальные</b> (от лат. <i>larynx</i> «гортань»)— согласные, образуемые в глотке (фарингальные) или в нижней части гортани (глоттальные). Подробнее см. признак A-21.</li></ol><p>Термин «гуттуральные согласные» не используется в списке значений признака в силу неоднозначности: он всегда включает фарингальные, часто также глоттальные, велярные или увулярные согласные.</p><p>О разновидностях согласных по способу образования см. признак A-16.</p><p>Помимо основных характеристик у согласных возможны дополнительные характеристики, подробнее см. признак A-22.</p>",,,2.1.1
