feature_id,feature_name_ru,value_type,value_id,value_ru,comment_ru,comment_en,page_numbers
A-1,Количество подъемов гласных,not_stated,,,Условное название вымершего языка мидийских племен (истор. обл. Мидия). Относился к северо-западной группе иранских языков древнего периода. Полностью восстановить фонологическую систему по отдельным словам в иноязычной передаче невозможно. Выявлены шесть гласных фонем и два дифтонга. Гласные приведены списком.,,
A-2,Подъемы гласных,not_stated,,,,,
A-3,Противопоставление по открытости/закрытости в подъемах гласных,not_applicable,,,,,
A-4,Ряды гласных,listed,A-4-2,Передний и непередний / задний,Ряды гласных постулируются.,,
A-5,Наличие фонологических ступеней долготы,listed,A-5-1,Присутствуют,,,
A-6,Фонологические ступени долготы,listed,A-6-1,Две ступени,,,
A-7,Наличие противопоставления гласных по лабиализации,listed,A-7-2,Отсутствует,,,
A-8,Противопоставление гласных по лабиализации,not_applicable,,,,,
A-9,Наличие противопоставления гласных по назализации,listed,A-9-2,Отсутствует,,,
A-10,Противопоставление гласных по назализации,not_applicable,,,,,
A-11,Противопоставление гласных по фарингализации,listed,A-11-1,Противопоставление гласных по фарингализации отсутствует,,,
A-12,Противопоставление гласных по продвинутости корня языка,listed,A-12-1,Противопоставление гласных по продвинутости корня языка отсутствует,,,
A-13,Наличие дифтонгов и трифтонгов,listed,A-13-2,Только дифтонги,,,
A-14,Типы дифтонгов,listed,A-14-2,Нисходящие,,,
A-15,Инвентарь шумных согласных по ларингальным признакам,listed,A-15-1,Противопоставление по звонкости/глухости,,,
A-16,Типы шумных согласных по способу артикуляции,listed,A-16-3,"Взрывные, аффрикаты и фрикативные",,,
A-17,Типы шумных согласных по месту образования,listed,A-17-2,"Губные, переднеязычные, палатальные, велярные/увулярные и ларингальные",,,
A-18,Типы шумных губных согласных по месту образования,listed,A-18-2,Губно-губные и губно-зубные,,,
A-19,Шумные переднеязычные согласные по месту образования,not_stated,,,Список из девяти переднеязычных согласных по месту образования терминологически не интерпретируется.,,
A-20,Типы шумных велярных и увулярных согласных по месту образования,listed,A-20-3,Велярные и увулярные,,,
A-21,Типы шумных ларингальных согласных по месту образования,listed,A-21-1,Только фарингальные,,,
A-22,Дополнительные артикуляционные противопоставления шумных согласных,listed,A-22-1,Отсутствуют,,,
A-23,Инвентарь сонорных согласных по способу артикуляции,custom,,Назальные и вибранты,,,
A-24,Инвентарь сонорных согласных по месту образования,listed,A-24-7,Лабиальные и переднеязычные,,,
A-25,Дополнительные противопоставления сонорных согласных,listed,A-25-1,Отсутствуют,,,
A-26,Инвентарь фрикативных согласных по месту образования,custom,,"Лабиальные, переднеязычные, среднеязычные, заднеязычные и постувулярные",Лабиальные: лабиодентальные глухой /f/ и звонкий /v/. Заднеязычные: увулярные (предположительно). Постувулярные: (нижне)фарингальные.,,
B-1,Вид основной просодической единицы,not_stated,,,,,
B-2,Носитель просодической единицы,not_stated,,,,,
B-3,Характеристика просодической единицы по ее мотивации выбора акцентной вершины,not_stated,,,Данных нет.,,
B-4,Вид ударения (качественные характеристики),not_stated,,,,,
B-5,Фиксированность ударения,not_stated,,,,,
B-6,Типы связанного ударения,not_stated,,,,,
B-7,Тип ударения при формообразовании (словоизменении),not_stated,,,,,
B-8,Тип строго фиксированного ударения (по положению в слове),not_stated,,,,,
B-9,Носители ограниченного (разноместного) ударения,not_stated,,,,,
B-10,Виды тонем,not_stated,,,,,
B-11,Количество уровневых тонов (уровней регистровых (ровных) тонов),not_stated,,,,,
B-12,"Типы уровневого (регистрового, ровного) тона",not_stated,,,,,
B-13,Количество уровней контурных тонов,not_stated,,,,,
B-14,"Типы контурных (скользящих, модулярных, модулированных) тонем",not_stated,,,,,
B-15,Характер долготы,listed,B-15-1,Фонологическая,Других данных нет.,,
B-16,Область гармонического уподобления гласных,not_stated,,,,,
B-17,Признак гармонического уподобления гласных,not_applicable,,,,,
B-18,Уподобляющий элемент при гармоническом уподоблении гласных,not_applicable,,,,,
B-19,Прочие супрасегментные явления,not_stated,,,,,
B-20,Типы фонации,not_stated,,,,,
C-1,Начальный согласный в слоге,explicit_gap,,,,,
C-2,Конечный согласный в слоге,explicit_gap,,,,,
C-3,Стечения согласных в слоге,explicit_gap,,,,,
D-1,Ограничения на фонемную структуру начала слова,explicit_gap,,,,,
D-2,Тип ограничений на фонемную структуру начала слова (анлаута),explicit_gap,,,,,
D-3,Ограничения на фонемную структуру в конце слова,explicit_gap,,,,,
D-4,Тип ограничений  на фонемную структуру в конце слова (ауслауте),explicit_gap,,,,,
D-5,Варианты особенностей слогового состава слова,explicit_gap,,,,,
D-6,Различия между знаменательными и служебными словами,not_stated,,,,,
D-7,Типы различий между знаменательными и служебными словами,not_applicable,,,Состав лексики неизвестен.,,
D-8,Различия между исконными и заимствованными словами,not_stated,,,,,
D-9,Типы различий между исконными и заимствованными словами,not_applicable,,,,,
D-10,Различия между корневыми и аффиксальными морфемами,not_stated,,,,,
D-11,Типы различий между корневыми и аффиксальными морфемами,not_applicable,,,,,
D-12,Функциональный тип чередований,explicit_gap,,,Типы чередований неизвестны.,,
D-13,Вид чередований,not_applicable,,,,,
E-1,Тип языка по способу соединения морфем в слове,explicit_gap,,,"Морфологический тип М.я. неизвестен. По косвенным данным, он был флективным.",,
E-2,Признаки флективного строя,not_applicable,,,,,
E-3,Признаки агглютинативного строя,not_applicable,,,,,
E-4,Тип языка по степени спаянности морфем,explicit_gap,,,,,
F-1,Количество согласовательных классов,explicit_gap,,,Состав и характер морфологичеких категорий неизвестен.,,
F-2,Морфологические способы выражения согласовательных классов,not_applicable,,,,,
F-3,Синтаксические способы выражения согласовательных классов,not_applicable,,,,,
F-4,Другие способы выражения согласовательных классов,not_applicable,,,,,
F-5,Атрибутивное согласование прилагательных по роду (в зависимости от числа),not_applicable,,,,,
F-6,Согласование количественных числительных в роде,not_applicable,,,,,
F-7,Классифицирующие категории существительных,not_applicable,,,,,
F-8,Противопоставление по личности/неличности,not_applicable,,,,,
F-9,Способ выражения одушевленности/неодушевленности,not_applicable,,,,,
G-1,Категория числа у существительных,explicit_gap,,,,,
G-2,Маркирование единственного числа существительных,not_applicable,,,,,
G-3,Формы вежливости в местоимениях и глаголах,not_applicable,,,,,
G-4,Согласование по числу,not_applicable,,,,,
G-5,Форма числа существительного в сочетании с числительными,not_applicable,,,,,
G-6,Система счисления,not_applicable,,,,,
H-1,Количество падежей у имени существительного,explicit_gap,,,,,
H-2,Маркирование субъекта и объекта,not_applicable,,,,,
H-3,Падежное оформление именного сказуемого,not_applicable,,,,,
H-4,Падежное оформление посессивного отношения в именной группе,not_applicable,,,,,
H-5,Другие способы оформления посессивного отношения,not_applicable,,,,,
H-6,Способ выражения пространственных отношений,not_applicable,,,,,
H-7,Маркирование в посессивной конструкции,not_applicable,,,,,
H-8,Падежное оформление одушевленных и неодушевленных имен существительных,not_applicable,,,,,
H-9,Наличие вторичных падежей,not_applicable,,,,,
I-1,Способ выражения залоговых форм в глаголе,explicit_gap,,,,,
I-2,Возможность наложения нескольких залоговых форм,not_applicable,,,,,
I-3,Двойные залоговые формы,not_applicable,,,,,
I-4,Совпадение залоговых форм,not_applicable,,,,,
I-5,Грамматические формы времени,explicit_gap,,,,,
I-6,Выражение вида и времени,not_applicable,,,,,
I-7,Способ выражения временных категорий,not_applicable,,,,,
I-8,Синкретическое выражение нескольких глагольных значений,not_applicable,,,,,
I-9,Маркирование лица в глаголе в настоящем времени,not_applicable,,,,,
I-10,Маркер переходности,not_stated,,,,,
J-1,Наличие местоименных слов,explicit_gap,,,,,
J-2,Способы выражения дейктических категорий,not_applicable,,,,,
J-3,"Служебные части речи, выражающие пространственную ориентацию действия",not_applicable,,,,,
J-4,"Знаменательные части речи, выражающие пространственную ориентацию действия",not_applicable,,,,,
J-5,Морфологическое выражение определенности/неопределенности имени,not_applicable,,,,,
J-6,"Части речи, выражающие определенность/неопределенность имени",not_applicable,,,,,
J-7,Грамматические способы выражения вежливости,not_applicable,,,,,
J-8,Способы выражения отрицания,explicit_gap,,,,,
J-9,Позиция показателя отрицания,not_applicable,,,,,
K-1,Склонение личных местоимений,explicit_gap,,,,,
K-2,Артикли,explicit_gap,,,,,
K-3,Неопределенный артикль и числительное «один»,not_applicable,,,,,
K-4,Расположение артикля,not_applicable,,,,,
K-5,Постановка артикля в именной группе,not_applicable,,,,,
K-6,"Грамматические категории, выражаемые артиклем",not_applicable,,,,,
K-7,Количество типов спряжения глаголов,explicit_gap,,,,,
K-8,Типы глагольного согласования,explicit_gap,,,,,
K-9,"Согласовательные категории, выражаемые причастием",explicit_gap,,,,,
K-10,"Время, выражаемое причастием",explicit_gap,,,,,
K-11,"Грамматические категории, выражаемые наречием",explicit_gap,,,,,
K-12,"Согласовательные категории, выражаемые прилагательным",explicit_gap,,,,,
K-13,Возможность кумулятивного выражения нескольких категорий в прилагательном,not_applicable,,,,,
K-14,Атрибутивное согласование прилагательных,not_applicable,,,,,
K-15,Типы атрибутивного согласования,explicit_gap,,,,,
K-16,"Изменяемые грамматические категории, выражаемые существительным",explicit_gap,,,,,
K-17,Кумулятивное выражение нескольких категорий в существительном,not_applicable,,,,,
K-18,Средства словоизменения,explicit_gap,,,,,
K-19,Модель словоформы,listed,K-19-4,Преимущественно или только суффиксальная,,,
L-1,Способы словообразования,listed,L-1-12,Аффиксация и словосложение,Выделяются суффиксальные образования и композиты.,,
L-2,"Аффиксы, участвующие в словообразовании",listed,L-2-2,Суффиксы,,,
L-3,Отношения между соединяемыми основами при сложении основ,listed,L-3-7,Только аппозиция,,,
M-1,Стратегия кодирования глагольных актантов,explicit_gap,,,,,
M-2,Фиксированность порядка слов,explicit_gap,,,Синтаксический строй неизвестен.,,
M-3,Основной порядок слов в предложении,explicit_gap,,,,,
M-4,Порядок определения и определяемого,explicit_gap,,,,,
M-5,Опущение местоименного подлежащего в неэллиптических предложениях,not_stated,,,,,
N-1,Линейный порядок компонентов в сложном предложении,explicit_gap,,,,,
N-2,Особенности подчиненного компонента в сложном предложении,not_applicable,,,,,
N-3,Оформление сказуемого в придаточном предложении,not_applicable,,,,,
N-4,Тип построения сложного предложения,explicit_gap,,,,,
N-5,Тип связи между элементами сложного предложения,not_applicable,,,,,
_aux,,not_applicable,,,А.К.Зотова/О.И.Романова,,
